{
  "schemaVersion": "1.0.0", "kind": "SpecForgeArtifact",
  "id": "question-deadline", "title": "Synthetic question about cancellation deadline",
  "type": "open-question",
  "content": {"question": "What cancellation deadline has the stakeholder decided?", "blocking": true, "resolution": null},
  "projectRef": {"id": "sample-project", "definitionSha256": "940f362fc13dbedd3db3b10f6b14ec9bb96ce20ab037a5807afbb4689af1cc6f"},
  "ownerRole": "ba", "revision": 1, "previousRevisionSha256": null,
  "createdAt": "2026-09-07T12:00:00.000Z", "updatedAt": "2026-09-07T12:00:00.000Z",
  "provenance": [{"actor": {"id": "synthetic-agent", "kind": "agent"}, "origin": "agent-proposed", "at": "2026-09-07T12:00:00.000Z", "sourceRefs": []}],
  "relationships": [], "status": "draft", "review": []
}
